{
  "id_caso": "TC-JS-004",
  "bloque_qa": "js",
  "tipo_prueba": "Funcional",
  "evaluador": {
    "nombre": "Juan Sebastián Gutiérrez Tobar",
    "rol": "js"
  },
  "fecha_ejecucion": "2026-09-28",
  "numero_ejecucion": 1,
  "ambiente": {
    "nombre": "QA",
    "url": "https://app-clima-local.vercel.app",
    "commit_o_version": "2ebd149"
  },
  "herramienta": "Playwright",
  "pasos_ejecutados": [
    "1. Simular error E-01 (sin conexión / fallo de red) al consultar «Bogotá» y verificar mensaje y botón Reintentar.",
    "2. Simular error E-02 (timeout > 10 s) con retardo de respuesta y validar mensaje de tiempo de espera y botón Reintentar.",
    "3. Simular error E-03 (HTTP 429 Too Many Requests) y validar mensaje de límite alcanzado sin filtrado de texto crudo de la API.",
    "4. Simular error E-04 (HTTP 400 Bad Request) y validar mensaje de consulta no procesable.",
    "5. Simular error E-05 (HTTP 500 / respuesta malformada) y validar mensaje de servicio no disponible.",
    "6. Comprobar recuperación funcional al pulsar el botón «Reintentar» tras la resolución del fallo de red.",
    "7. Verificar ausencia de errores no controlados en la consola del navegador a lo largo de todos los escenarios."
  ],
  "comandos_ejecucion": [
    "npx playwright test --config=qa/playwright.config.ts qa/casos/js/TC-JS-004/TC-JS-004.spec.ts --project=js"
  ],
  "resultado_esperado": "Para cada error, se muestra el mensaje exacto del catálogo en una región role=\"alert\", con botón Reintentar visible, sin romper el resto de la interfaz y sin mostrar texto crudo de la API.",
  "resultado_obtenido": "Las 6 pruebas automatizadas pasaron satisfactoriamente (6/6). La aplicación clasifica de forma precisa cada fallo de red y HTTP (E-01 a E-05) presentando los mensajes en español correspondientes en una región accesible role=\"alert\", incorpora el botón interactivo «Reintentar», oculta cualquier detalle técnico interno de la API, y permite recuperar la búsqueda exitosamente al accionar dicho botón sin recargar la página.",
  "tiempo_respuesta_ms": 16000,
  "estado": "Aprobado",
  "bug_id": null,
  "incidente_id": null,
  "evidencias": [
    "app-clima-local/qa/casos/js/TC-JS-004/evidencias/TC-JS-004__2026-09-28__run01/e01-sin-conexion.png",
    "app-clima-local/qa/casos/js/TC-JS-004/evidencias/TC-JS-004__2026-09-28__run01/e02-timeout.png",
    "app-clima-local/qa/casos/js/TC-JS-004/evidencias/TC-JS-004__2026-09-28__run01/e03-limite-429.png",
    "app-clima-local/qa/casos/js/TC-JS-004/evidencias/TC-JS-004__2026-09-28__run01/e04-bad-request-400.png",
    "app-clima-local/qa/casos/js/TC-JS-004/evidencias/TC-JS-004__2026-09-28__run01/e05-error-servidor-500.png",
    "app-clima-local/qa/casos/js/TC-JS-004/evidencias/TC-JS-004__2026-09-28__run01/reintento-exitoso.png"
  ],
  "observaciones": "El módulo de búsqueda manual cumple con la totalidad del catálogo de errores definido en la sección 1.1 de requerimientos. El botón Reintentar conserva el texto original ingresado por el usuario y dispara un nuevo ciclo con cancelación previa (AbortController)."
}
