{
  "id_caso": "TC-JS-003",
  "bloque_qa": "js",
  "tipo_prueba": "Funcional",
  "evaluador": {
    "nombre": "Juan Sebastián Gutiérrez Tobar",
    "rol": "js"
  },
  "fecha_ejecucion": "2026-09-28",
  "numero_ejecucion": 1,
  "ambiente": {
    "nombre": "QA",
    "url": "https://app-clima-local.vercel.app",
    "commit_o_version": "2ebd149"
  },
  "herramienta": "Playwright",
  "pasos_ejecutados": [
    "1. Agregar 2 ciudades (Bogotá y Medellín) y validar tabla de comparación lado a lado con columnas correspondientes.",
    "2. Agregar 4 ciudades (Bogotá, Medellín, Cali y Barranquilla) y validar visualización de datos y contador 4 de 4.",
    "3. Intentar agregar una 5.ª ciudad (Neiva) y validar advertencia de límite máximo.",
    "4. Intentar agregar una ciudad duplicada (Bogotá) y validar mensaje de control de duplicados.",
    "5. Iniciar comparación con menos de 2 ciudades y validar mensaje informativo de mínimo requerido.",
    "6. Simular respuesta de pronóstico con valores nulos (humedad, precipitación, dirección, UV) y verificar visualización de «N/D» sin ruptura de la tabla.",
    "7. Reducir viewport a 320 px (móvil compacto) y comprobar adaptación con desplazamiento horizontal de la tabla.",
    "8. Navegar y operar acciones de eliminación de ciudad mediante teclado (Enter/Espacio) y verificar actualización del estado.",
    "9. Verificar ausencia de errores no controlados en la consola del navegador a lo largo de toda la suite."
  ],
  "comandos_ejecucion": [
    "npx playwright test --config=qa/playwright.config.ts qa/casos/js/TC-JS-003/TC-JS-003.spec.ts --project=js"
  ],
  "resultado_esperado": "1. 2 y 4 ciudades: vista lado a lado correcta. 2. 5.ª: mensaje «Puede comparar hasta 4 ciudades a la vez.» 3. Duplicada: mensaje «Esta ubicación ya está en la comparación.» 4. Menos de 2: mensaje «Agregue al menos dos ciudades para comparar.» 5. Nulo: se muestra «N/D» en esa celda. 6. Móvil: tabla se desplaza horizontalmente dentro de su contenedor o se apila, sin romper. 7. Teclado: navegación completa y operación con Enter/Espacio.",
  "resultado_obtenido": "Las 7 pruebas automatizadas que cubren todos los pasos pasaron satisfactoriamente (7/7). La tabla comparativa organiza de 2 a 4 ciudades lado a lado con encabezados semánticos; el sistema bloquea y anuncia adecuadamente la 5.ª ciudad y duplicados mediante alertas accesibles; maneja valores nulos mostrando «N/D» en cada métrica afectada; la tabla contiene scroll horizontal responsivo en viewports reducidos (320 px); y los controles son 100% operables mediante teclado.",
  "tiempo_respuesta_ms": 8900,
  "estado": "Aprobado",
  "bug_id": null,
  "incidente_id": null,
  "evidencias": [
    "app-clima-local/qa/casos/js/TC-JS-003/evidencias/TC-JS-003__2026-09-28__run01/paso1-dos-ciudades.png",
    "app-clima-local/qa/casos/js/TC-JS-003/evidencias/TC-JS-003__2026-09-28__run01/paso2-cuatro-ciudades.png",
    "app-clima-local/qa/casos/js/TC-JS-003/evidencias/TC-JS-003__2026-09-28__run01/paso3-limite-quinta-ciudad.png",
    "app-clima-local/qa/casos/js/TC-JS-003/evidencias/TC-JS-003__2026-09-28__run01/paso4-ciudad-duplicada.png",
    "app-clima-local/qa/casos/js/TC-JS-003/evidencias/TC-JS-003__2026-09-28__run01/paso5-menos-de-dos-ciudades.png",
    "app-clima-local/qa/casos/js/TC-JS-003/evidencias/TC-JS-003__2026-09-28__run01/paso6-valores-nulos-nd.png",
    "app-clima-local/qa/casos/js/TC-JS-003/evidencias/TC-JS-003__2026-09-28__run01/paso7-adaptabilidad-movil.png",
    "app-clima-local/qa/casos/js/TC-JS-003/evidencias/TC-JS-003__2026-09-28__run01/paso8-operabilidad-teclado.png"
  ],
  "observaciones": "Comportamiento 100% conforme con la especificación de RF-04. La tabla de comparación incluye tanto el clima actual comparado como el pronóstico diario sincronizado por fecha local en común. Las llamadas a Open-Meteo se efectúan en paralelo con cancelación automática si el usuario retira ciudades."
}
