{
  "id_caso": "TC-JS-005",
  "bloque_qa": "js",
  "tipo_prueba": "Funcional",
  "evaluador": {
    "nombre": "Juan Sebastián Gutiérrez Tobar",
    "rol": "js"
  },
  "fecha_ejecucion": "2026-09-28",
  "numero_ejecucion": 1,
  "ambiente": {
    "nombre": "QA",
    "url": "https://app-clima-local.vercel.app",
    "commit_o_version": "2ebd149"
  },
  "herramienta": "Playwright",
  "pasos_ejecutados": [
    "1. Iniciar comparación entre Bogotá y Medellín.",
    "2. Interceptar y provocar error E-01 (sin conexión) solo en la llamada de Medellín y verificar datos de Bogotá y celdas N/D en Medellín.",
    "3. Interceptar y provocar error E-02 (timeout > 10 s) solo en Medellín y verificar alerta de tiempo de espera.",
    "4. Interceptar y provocar error E-03 (HTTP 429) solo en Medellín y verificar alerta de límite de consultas.",
    "5. Interceptar y provocar error E-04 (HTTP 400) solo en Medellín y verificar alerta de parámetros inválidos.",
    "6. Interceptar y provocar error E-05 (HTTP 500) solo en Medellín y verificar alerta de servicio meteorológico no disponible.",
    "7. Pulsar el botón «Reintentar Medellín» tras restablecer la red y comprobar la recuperación aislada de sus métricas.",
    "8. Verificar ausencia de errores no controlados en la consola del navegador a lo largo de toda la suite."
  ],
  "comandos_ejecucion": [
    "npx playwright test --config=qa/playwright.config.ts qa/casos/js/TC-JS-005/TC-JS-005.spec.ts --project=js"
  ],
  "resultado_esperado": "La columna de la ciudad fallida muestra el mensaje de error E-XX en role=\"alert\" con botón Reintentar; la otra columna muestra sus datos normalmente. La interfaz no se rompe.",
  "resultado_obtenido": "Las 6 pruebas automatizadas pasaron satisfactoriamente (6/6). El sistema aísla por completo el fallo de una ciudad específica: la columna de Medellín degrada controladamente a «N/D» en sus celdas sin distorsionar la cuadrícula de datos, muestra la alerta descriptiva correspondiente en role=\"alert\" con su botón «Reintentar Medellín», mientras que la columna de Bogotá presenta íntegramente sus condiciones climáticas en tiempo real. La ejecución del reintento recuperó a Medellín exitosamente sin requerir recarga de la página.",
  "tiempo_respuesta_ms": 19100,
  "estado": "Aprobado",
  "bug_id": null,
  "incidente_id": null,
  "evidencias": [
    "app-clima-local/qa/casos/js/TC-JS-005/evidencias/TC-JS-005__2026-09-28__run01/e01-fallo-medellin.png",
    "app-clima-local/qa/casos/js/TC-JS-005/evidencias/TC-JS-005__2026-09-28__run01/e02-timeout-medellin.png",
    "app-clima-local/qa/casos/js/TC-JS-005/evidencias/TC-JS-005__2026-09-28__run01/e03-limite-429-medellin.png",
    "app-clima-local/qa/casos/js/TC-JS-005/evidencias/TC-JS-005__2026-09-28__run01/e04-bad-request-medellin.png",
    "app-clima-local/qa/casos/js/TC-JS-005/evidencias/TC-JS-005__2026-09-28__run01/e05-error-servidor-medellin.png",
    "app-clima-local/qa/casos/js/TC-JS-005/evidencias/TC-JS-005__2026-09-28__run01/reintento-selectivo-exitoso.png"
  ],
  "observaciones": "Comportamiento conforme a los requerimientos no funcionales de fiabilidad y tolerancia a fallos parciales en el módulo de comparación (RF-04). Las peticiones independientes por ciudad garantizan que una falla de red o de servicio puntual no inutilice la experiencia de comparación de las demás ciudades activas."
}
