{
  "id_caso": "TC-JS-009",
  "bloque_qa": "js",
  "tipo_prueba": "Rendimiento",
  "evaluador": {
    "nombre": "Juan Sebastián Gutiérrez Tobar",
    "rol": "js"
  },
  "fecha_ejecucion": "2026-09-28",
  "numero_ejecucion": 1,
  "ambiente": {
    "nombre": "QA",
    "url": "https://app-clima-local.vercel.app",
    "commit_o_version": "2ebd149"
  },
  "herramienta": "k6",
  "pasos_ejecutados": [
    "1. Configurar script de k6 para ejecutar 100 peticiones de consulta HTTP GET a /v1/search rotando entre «Bogotá», «Medellín» y «Cali».",
    "2. Ejecutar la prueba de rendimiento mediante k6 midiendo http_req_duration, tasa de fallos y validaciones de respuesta.",
    "3. Calcular percentil 95 (p95), promedio, mínimo y máximo de tiempo de respuesta.",
    "4. Exportar métricas estructuradas en k6-metricas.json y generar evidencia visual del resultado."
  ],
  "comandos_ejecucion": [
    "k6 run --summary-export=qa/casos/js/TC-JS-009/evidencias/TC-JS-009__2026-09-28__run01/k6-metricas.json qa/casos/js/TC-JS-009/TC-JS-009.k6.js"
  ],
  "resultado_esperado": "p95 < 500 ms (RNF-01)",
  "resultado_obtenido": "La prueba de rendimiento con 100 peticiones en k6 se completó con 100% de éxito (300/300 checks cumplidos, tasa de fallos 0.00%). El percentil 95 obtenido fue p(95) = 310.06 ms, cumpliendo holgadamente el criterio de aceptación de RNF-01 (umbral < 500 ms). Tiempos registrados: avg = 240.07 ms, min = 185.25 ms, med = 238.46 ms, max = 419.43 ms, p90 = 298.48 ms.",
  "tiempo_respuesta_ms": 310.06,
  "estado": "Aprobado",
  "bug_id": null,
  "incidente_id": null,
  "evidencias": [
    "app-clima-local/qa/casos/js/TC-JS-009/evidencias/TC-JS-009__2026-09-28__run01/k6-metricas.json",
    "app-clima-local/qa/casos/js/TC-JS-009/evidencias/TC-JS-009__2026-09-28__run01/resumen-rendimiento-p95.png"
  ],
  "observaciones": "El endpoint de geocodificación responde de forma rápida y consistente bajo carga moderada sin degradación. El valor de p(95) de 310.06 ms supera con creces la exigencia no funcional de respuesta ágil en la búsqueda (RNF-01 < 500 ms)."
}
